{
  "$schema": "https://opennoodl.dev/schemas/registry-v2.json",
  "version": 1,
  "lastUpdated": "2026-08-28T17:45:04.282Z",
  "components": {
    "App": {
      "path": "App",
      "type": "root",
      "nodeCount": 1,
      "connectionCount": 0,
      "created": "2026-08-28T17:42:07.258Z",
      "modified": "2026-08-28T17:42:07.258Z"
    },
    "Pages/Home": {
      "path": "Pages/Home",
      "type": "page",
      "nodeCount": 23,
      "connectionCount": 15,
      "modified": "2026-08-28T17:45:04.282Z",
      "created": "2026-08-28T17:42:07.258Z"
    }
  },
  "stats": {
    "totalComponents": 2,
    "totalNodes": 24,
    "totalConnections": 15
  }
}