{
  "$schema": "https://opennoodl.dev/schemas/registry-v2.json",
  "version": 1,
  "lastUpdated": "2026-08-30T21:40:00.000Z",
  "components": {
    "App": {
      "path": "App",
      "type": "root",
      "nodeCount": 1,
      "connectionCount": 0,
      "created": "2026-08-30T21:40:00.000Z",
      "modified": "2026-08-30T21:40:00.000Z"
    },
    "Pages/Badge": {
      "path": "Pages/Badge",
      "type": "page",
      "nodeCount": 14,
      "connectionCount": 12,
      "created": "2026-08-30T21:40:00.000Z",
      "modified": "2026-08-30T21:40:00.000Z"
    }
  },
  "stats": {
    "totalComponents": 2,
    "totalNodes": 15,
    "totalConnections": 12
  }
}
