{
  "$schema": "https://opennoodl.dev/schemas/registry-v2.json",
  "version": 1,
  "lastUpdated": "2026-09-10T19:03:40.082Z",
  "components": {
    "Parts/Format Date": {
      "path": "Parts/Format Date",
      "type": "logic",
      "nodeCount": 4,
      "connectionCount": 6,
      "modified": "2026-09-10T19:03:39.976Z",
      "created": "2026-09-10T19:03:39.976Z"
    },
    "Parts/Format Full Name": {
      "path": "Parts/Format Full Name",
      "type": "logic",
      "nodeCount": 3,
      "connectionCount": 6,
      "modified": "2026-09-10T19:03:40.047Z",
      "created": "2026-09-10T19:03:40.047Z"
    },
    "Parts/Sanitise Email": {
      "path": "Parts/Sanitise Email",
      "type": "logic",
      "nodeCount": 3,
      "connectionCount": 4,
      "modified": "2026-09-10T19:03:40.082Z",
      "created": "2026-09-10T19:03:40.082Z"
    }
  },
  "stats": {
    "totalComponents": 3,
    "totalNodes": 10,
    "totalConnections": 16
  }
}